{
  "schema": "nib.hardware-profile/v1",
  "id": "b200x2-tdx",
  "gpu": {
    "model": "H100",
    "count": 1
  },
  "cc_mode": "single-gpu-cc",
  "cpu": {
    "architecture": "x86_64",
    "generation": "synthetic-test-fixture"
  },
  "vm": {
    "vcpus": 2,
    "memory_mib": 1024
  },
  "qemu": {
    "version": "1.2.3",
    "sha256": "aaaaaaaaaaaaaaaaaaaaaaaaaaaaaaaaaaaaaaaaaaaaaaaaaaaaaaaaaaaaaaaa",
    "args": [
      "-fixture-only"
    ]
  },
  "ovmf": {
    "revision": "1111111111111111111111111111111111111111",
    "sha256": "bbbbbbbbbbbbbbbbbbbbbbbbbbbbbbbbbbbbbbbbbbbbbbbbbbbbbbbbbbbbbbbb"
  },
  "pci_devices": [
    {
      "address": "0000:01:00.0",
      "kind": "gpu"
    }
  ]
}
